title,description,full_text,category,source,quality_score,data_source,download_date,text_length,word_count
Senate Committee Advances Infrastructure Bill with Bipartisan Support,"The Senate Transportation Committee voted 15-5 to advance a $2.1 trillion infrastructure package that includes funding for roads, bridges, broadband, and clean energy initiatives.","Senate Committee Advances Infrastructure Bill with Bipartisan Support. The Senate Transportation Committee voted 15-5 to advance a $2.1 trillion infrastructure package that includes funding for roads, bridges, broadband, and clean energy initiatives.",POLITICS,Political Wire,9.2,HighQualitySamples,2026-06-23T04:02:53.725608,250,32
Supreme Court to Hear Arguments on Digital Privacy Rights,The Supreme Court will review a case concerning whether law enforcement agencies need warrants to access smartphone location data stored by telecommunications companies.,Supreme Court to Hear Arguments on Digital Privacy Rights. The Supreme Court will review a case concerning whether law enforcement agencies need warrants to access smartphone location data stored by telecommunications companies.,POLITICS,Constitutional Law Review,8.8,HighQualitySamples,2026-06-23T04:02:53.725608,228,32
FIFA World Cup Breaks Viewership Records as Global Audience Reaches 5 Billion,"The 2026 FIFA World Cup final attracted the largest television audience in sports history, with over 1.5 billion viewers watching the championship match simultaneously across all time zones.","FIFA World Cup Breaks Viewership Records as Global Audience Reaches 5 Billion. The 2026 FIFA World Cup final attracted the largest television audience in sports history, with over 1.5 billion viewers watching the championship match simultaneously across all time zones.",SPORTS,Sports Broadcasting International,9.1,HighQualitySamples,2026-06-23T04:02:53.725608,269,40
Olympic Committee Announces New Sustainability Standards for Future Games,The International Olympic Committee unveiled comprehensive environmental guidelines requiring host cities to achieve carbon neutrality and utilize 100% renewable energy sources for all Olympic venues.,Olympic Committee Announces New Sustainability Standards for Future Games. The International Olympic Committee unveiled comprehensive environmental guidelines requiring host cities to achieve carbon neutrality and utilize 100% renewable energy sources for all Olympic venues.,SPORTS,Olympic News Network,8.7,HighQualitySamples,2026-06-23T04:02:53.725608,275,34
Quantum Computing Breakthrough Achieves Error Correction Milestone,"Researchers at MIT successfully demonstrated quantum error correction using 1,000 physical qubits to create 100 logical qubits, marking a significant step toward practical quantum computing applications.","Quantum Computing Breakthrough Achieves Error Correction Milestone. Researchers at MIT successfully demonstrated quantum error correction using 1,000 physical qubits to create 100 logical qubits, marking a significant step toward practical quantum computing applications.",TECHNOLOGY,MIT Technology Review,9.5,HighQualitySamples,2026-06-23T04:02:53.725608,271,33
AI Safety Institute Publishes Guidelines for Large Language Model Development,"Leading AI researchers released comprehensive safety protocols for developing and deploying large language models, addressing concerns about bias, misuse, and potential societal impacts of advanced AI systems.","AI Safety Institute Publishes Guidelines for Large Language Model Development. Leading AI researchers released comprehensive safety protocols for developing and deploying large language models, addressing concerns about bias, misuse, and potential societal impacts of advanced AI systems.",TECHNOLOGY,AI Safety Research,9.3,HighQualitySamples,2026-06-23T04:02:53.725608,288,37
Streaming Wars Intensify as Platforms Invest $50 Billion in Original Content,"Major streaming services announced record-breaking investment in original programming, with Netflix, Disney+, and Amazon Prime Video leading a content creation arms race to attract and retain subscribers.","Streaming Wars Intensify as Platforms Invest $50 Billion in Original Content. Major streaming services announced record-breaking investment in original programming, with Netflix, Disney+, and Amazon Prime Video leading a content creation arms race to attract and retain subscribers.",ENTERTAINMENT,Entertainment Industry Report,8.9,HighQualitySamples,2026-06-23T04:02:53.725608,282,38
Taylor Swift Eras Tour Generates $1.9 Billion in Revenue Breaking Concert Records,"The pop superstar concludes her unprecedented world tour after performing 152 shows across 5 continents, setting new standards for concert production, fan engagement, and economic impact on host cities.","Taylor Swift Eras Tour Generates $1.9 Billion in Revenue Breaking Concert Records. The pop superstar concludes her unprecedented world tour after performing 152 shows across 5 continents, setting new standards for concert production, fan engagement, and economic impact on host cities.",ENTERTAINMENT,Music Industry News,9.0,HighQualitySamples,2026-06-23T04:02:53.725608,285,41
Federal Reserve Maintains Interest Rates Amid Economic Uncertainty,"The Federal Open Market Committee voted to keep the federal funds rate unchanged at 5.25-5.50%, citing mixed economic indicators and ongoing concerns about inflation and employment levels.","Federal Reserve Maintains Interest Rates Amid Economic Uncertainty. The Federal Open Market Committee voted to keep the federal funds rate unchanged at 5.25-5.50%, citing mixed economic indicators and ongoing concerns about inflation and employment levels.",BUSINESS,Financial Times,9.4,HighQualitySamples,2026-06-23T04:02:53.725608,256,35
Renewable Energy Investments Reach $2.8 Trillion Globally in 2026,"International Energy Agency reports unprecedented investment in solar, wind, and battery storage technologies as governments and corporations accelerate transition to sustainable energy sources.","Renewable Energy Investments Reach $2.8 Trillion Globally in 2026. International Energy Agency reports unprecedented investment in solar, wind, and battery storage technologies as governments and corporations accelerate transition to sustainable energy sources.",BUSINESS,Energy Market Analysis,9.1,HighQualitySamples,2026-06-23T04:02:53.725608,261,32
Congress passes bipartisan legislation addressing healthcare reform with overwhelming support from both parties.,Detailed analysis of congress passes bipartisan legislation addressing healthcare reform with overwhelming support from both parties.,Congress passes bipartisan legislation addressing healthcare reform with overwhelming support from both parties.. Detailed analysis of congress passes bipartisan legislation addressing healthcare reform with overwhelming support from both parties.,POLITICS,Sample News POLITICS,8.0,HighQualitySamples,2026-06-23T04:02:53.725608,247,29
State governors convene emergency meeting to discuss climate policy implementation strategies.,Detailed analysis of state governors convene emergency meeting to discuss climate policy implementation strategies.,State governors convene emergency meeting to discuss climate policy implementation strategies.. Detailed analysis of state governors convene emergency meeting to discuss climate policy implementation strategies.,POLITICS,Sample News POLITICS,8.3,HighQualitySamples,2026-06-23T04:02:53.725608,211,25
International summit focuses on education funding cooperation and diplomatic solutions.,Detailed analysis of international summit focuses on education funding cooperation and diplomatic solutions.,International summit focuses on education funding cooperation and diplomatic solutions.. Detailed analysis of international summit focuses on education funding cooperation and diplomatic solutions.,POLITICS,Sample News POLITICS,8.6,HighQualitySamples,2026-06-23T04:02:53.725608,197,23
Supreme Court case challenges existing laws regarding tax reform constitutional rights.,Detailed analysis of supreme court case challenges existing laws regarding tax reform constitutional rights.,Supreme Court case challenges existing laws regarding tax reform constitutional rights.. Detailed analysis of supreme court case challenges existing laws regarding tax reform constitutional rights.,POLITICS,Sample News POLITICS,8.0,HighQualitySamples,2026-06-23T04:02:53.725608,197,25
Championship game draws massive audience as Lakers defeats rivals in overtime thriller.,Detailed analysis of championship game draws massive audience as lakers defeats rivals in overtime thriller.,Championship game draws massive audience as Lakers defeats rivals in overtime thriller.. Detailed analysis of championship game draws massive audience as lakers defeats rivals in overtime thriller.,SPORTS,Sample News SPORTS,8.0,HighQualitySamples,2026-06-23T04:02:53.725608,197,27
Olympic athlete sets new world record in swimming competition at international games.,Detailed analysis of olympic athlete sets new world record in swimming competition at international games.,Olympic athlete sets new world record in swimming competition at international games.. Detailed analysis of olympic athlete sets new world record in swimming competition at international games.,SPORTS,Sample News SPORTS,8.3,HighQualitySamples,2026-06-23T04:02:53.725608,193,27
Professional league announces expansion with new franchises in major markets.,Detailed analysis of professional league announces expansion with new franchises in major markets.,Professional league announces expansion with new franchises in major markets.. Detailed analysis of professional league announces expansion with new franchises in major markets.,SPORTS,Sample News SPORTS,8.6,HighQualitySamples,2026-06-23T04:02:53.725608,177,23
Sports medicine breakthrough helps athletes recover faster from bone fracture treatments.,Detailed analysis of sports medicine breakthrough helps athletes recover faster from bone fracture treatments.,Sports medicine breakthrough helps athletes recover faster from bone fracture treatments.. Detailed analysis of sports medicine breakthrough helps athletes recover faster from bone fracture treatments.,SPORTS,Sample News SPORTS,8.0,HighQualitySamples,2026-06-23T04:02:53.725608,201,25
Tech startup receives $100 million funding for revolutionary technology platform.,Detailed analysis of tech startup receives $100 million funding for revolutionary technology platform.,Tech startup receives $100 million funding for revolutionary technology platform.. Detailed analysis of tech startup receives $100 million funding for revolutionary technology platform.,TECHNOLOGY,Sample News TECHNOLOGY,8.0,HighQualitySamples,2026-06-23T04:02:53.725608,185,23
Cybersecurity researchers discover vulnerability in popular software applications.,Detailed analysis of cybersecurity researchers discover vulnerability in popular software applications.,Cybersecurity researchers discover vulnerability in popular software applications.. Detailed analysis of cybersecurity researchers discover vulnerability in popular software applications.,TECHNOLOGY,Sample News TECHNOLOGY,8.3,HighQualitySamples,2026-06-23T04:02:53.725608,187,19
Major corporation deploys AI system to improve process efficiency and accuracy.,Detailed analysis of major corporation deploys ai system to improve process efficiency and accuracy.,Major corporation deploys AI system to improve process efficiency and accuracy.. Detailed analysis of major corporation deploys ai system to improve process efficiency and accuracy.,TECHNOLOGY,Sample News TECHNOLOGY,8.6,HighQualitySamples,2026-06-23T04:02:53.725608,181,25
Open source project reaches milestone with number contributors worldwide.,Detailed analysis of open source project reaches milestone with number contributors worldwide.,Open source project reaches milestone with number contributors worldwide.. Detailed analysis of open source project reaches milestone with number contributors worldwide.,TECHNOLOGY,Sample News TECHNOLOGY,8.0,HighQualitySamples,2026-06-23T04:02:53.725608,169,21
Award-winning director announces new genre film featuring ensemble cast.,Detailed analysis of award-winning director announces new genre film featuring ensemble cast.,Award-winning director announces new genre film featuring ensemble cast.. Detailed analysis of award-winning director announces new genre film featuring ensemble cast.,ENTERTAINMENT,Sample News ENTERTAINMENT,8.0,HighQualitySamples,2026-06-23T04:02:53.725608,167,21
Music festival lineup reveals headlining artists for summer concert series.,Detailed analysis of music festival lineup reveals headlining artists for summer concert series.,Music festival lineup reveals headlining artists for summer concert series.. Detailed analysis of music festival lineup reveals headlining artists for summer concert series.,ENTERTAINMENT,Sample News ENTERTAINMENT,8.3,HighQualitySamples,2026-06-23T04:02:53.725608,173,23
Streaming platform orders multiple seasons of original type programming.,Detailed analysis of streaming platform orders multiple seasons of original type programming.,Streaming platform orders multiple seasons of original type programming.. Detailed analysis of streaming platform orders multiple seasons of original type programming.,ENTERTAINMENT,Sample News ENTERTAINMENT,8.6,HighQualitySamples,2026-06-23T04:02:53.725608,167,21
Celebrity couple launches charitable foundation supporting cause initiatives.,Detailed analysis of celebrity couple launches charitable foundation supporting cause initiatives.,Celebrity couple launches charitable foundation supporting cause initiatives.. Detailed analysis of celebrity couple launches charitable foundation supporting cause initiatives.,ENTERTAINMENT,Sample News ENTERTAINMENT,8.0,HighQualitySamples,2026-06-23T04:02:53.725608,177,19
Fortune 500 company reports record quarterly earnings exceeding analyst expectations.,Detailed analysis of fortune 500 company reports record quarterly earnings exceeding analyst expectations.,Fortune 500 company reports record quarterly earnings exceeding analyst expectations.. Detailed analysis of fortune 500 company reports record quarterly earnings exceeding analyst expectations.,BUSINESS,Sample News BUSINESS,8.0,HighQualitySamples,2026-06-23T04:02:53.725608,193,23
Startup disrupts traditional industry market with innovative business model.,Detailed analysis of startup disrupts traditional industry market with innovative business model.,Startup disrupts traditional industry market with innovative business model.. Detailed analysis of startup disrupts traditional industry market with innovative business model.,BUSINESS,Sample News BUSINESS,8.3,HighQualitySamples,2026-06-23T04:02:53.725608,175,21
Central bank adjusts monetary policy to address economic_factor concerns.,Detailed analysis of central bank adjusts monetary policy to address economic_factor concerns.,Central bank adjusts monetary policy to address economic_factor concerns.. Detailed analysis of central bank adjusts monetary policy to address economic_factor concerns.,BUSINESS,Sample News BUSINESS,8.6,HighQualitySamples,2026-06-23T04:02:53.725608,169,21
International trade agreement opens new markets for product exports.,Detailed analysis of international trade agreement opens new markets for product exports.,International trade agreement opens new markets for product exports.. Detailed analysis of international trade agreement opens new markets for product exports.,BUSINESS,Sample News BUSINESS,8.0,HighQualitySamples,2026-06-23T04:02:53.725608,159,21
